{"schemaVersion":1,"root":"AvivPeretsFBX","displayName":"AvivPeretsFBX","supportContact":{"kind":"secure-url","value":"https://example.com/package-builder-support"},"copyright":{"holder":"Publisher Name (review before publication)","yearPolicy":{"kind":"publication-year","year":2026}},"aiDisclosure":{"state":"undeclared"}}
